{
  "$schema": "../../schemas/project-fixture.schema.json",
  "schemaVersion": 1,
  "fixtureId": "fixture.full-week.week28",
  "workspace": { "id": "workspace.cortex-diary", "name": "Cortex Diary", "localCanonical": true },
  "project": { "id": "project.week28", "name": "Cortex Diary · Week 28", "kind": "weekly_operation", "week": "2026-W28" },
  "expectedObjectCount": 50,
  "objects": [
    { "id": "intent.capture", "name": "Quick capture", "lane": "intent", "kind": "source", "status": "done", "version": "v1", "detail": "Original note and voice memo", "sensitivity": "personal", "sourceRefs": [], "approvalState": "not_applicable", "publishState": "not_applicable", "outcomeState": "not_applicable", "permissions": ["files.import"], "canonical": true },
    { "id": "idea.creator-os", "name": "Creator OS idea", "lane": "intent", "kind": "artifact", "status": "done", "version": "v4", "detail": "Canonical idea", "sensitivity": "workspace", "sourceRefs": ["intent.capture"], "approvalState": "granted", "publishState": "not_applicable", "outcomeState": "not_applicable", "permissions": ["workspace.read"], "canonical": true },
    { "id": "brief.week28", "name": "Week 28 brief", "lane": "intent", "kind": "artifact", "status": "done", "version": "v1", "detail": "Full-Week entry contract", "sensitivity": "workspace", "sourceRefs": ["idea.creator-os"], "approvalState": "granted", "publishState": "not_applicable", "outcomeState": "not_applicable", "permissions": ["workspace.read"], "canonical": true },
    { "id": "memory.audience", "name": "AI PM audience", "lane": "intent", "kind": "memory", "status": "done", "version": "rev3", "detail": "Workspace audience scope", "sensitivity": "personal", "sourceRefs": [], "approvalState": "granted", "publishState": "not_applicable", "outcomeState": "not_applicable", "permissions": ["memory.retrieve"], "canonical": true },
    { "id": "policy.goal", "name": "Build-in-public goal", "lane": "intent", "kind": "policy", "status": "done", "version": "rev2", "detail": "Authority over raw reach", "sensitivity": "personal", "sourceRefs": [], "approvalState": "granted", "publishState": "not_applicable", "outcomeState": "not_applicable", "permissions": ["policy.read"], "canonical": true },
    { "id": "gate.budget", "name": "$50 run budget", "lane": "intent", "kind": "gate", "status": "done", "detail": "Hard paid-call ceiling", "sensitivity": "workspace", "sourceRefs": ["brief.week28"], "approvalState": "granted", "publishState": "not_applicable", "outcomeState": "not_applicable", "permissions": ["budget.enforce"] },
    { "id": "policy.confidentiality", "name": "Confidentiality", "lane": "intent", "kind": "policy", "status": "done", "version": "rev5", "detail": "No internal work details", "sensitivity": "confidential", "sourceRefs": [], "approvalState": "granted", "publishState": "not_applicable", "outcomeState": "not_applicable", "permissions": ["policy.enforce"], "canonical": true },

    { "id": "source.hermes", "name": "Hermes harness", "lane": "evidence", "kind": "source", "status": "done", "detail": "Memory and skill-loop evidence", "sensitivity": "public", "sourceRefs": [], "approvalState": "not_applicable", "publishState": "not_applicable", "outcomeState": "not_applicable", "permissions": ["source.read"], "canonical": true },
    { "id": "source.agent-skills", "name": "Agent Skills spec", "lane": "evidence", "kind": "source", "status": "done", "detail": "Package contract", "sensitivity": "public", "sourceRefs": [], "approvalState": "not_applicable", "publishState": "not_applicable", "outcomeState": "not_applicable", "permissions": ["source.read"], "canonical": true },
    { "id": "source.mcp-tasks", "name": "MCP Tasks", "lane": "evidence", "kind": "source", "status": "done", "detail": "Experimental async protocol", "sensitivity": "public", "sourceRefs": [], "approvalState": "not_applicable", "publishState": "not_applicable", "outcomeState": "not_applicable", "permissions": ["source.read"], "canonical": true },
    { "id": "source.postiz", "name": "Postiz MCP", "lane": "evidence", "kind": "source", "status": "done", "detail": "Distribution capability", "sensitivity": "public", "sourceRefs": [], "approvalState": "not_applicable", "publishState": "not_applicable", "outcomeState": "not_applicable", "permissions": ["source.read"], "canonical": true },
    { "id": "source.pixverse", "name": "PixVerse Canvas", "lane": "evidence", "kind": "source", "status": "done", "detail": "Competitive overlap", "sensitivity": "public", "sourceRefs": [], "approvalState": "not_applicable", "publishState": "not_applicable", "outcomeState": "not_applicable", "permissions": ["source.read"], "canonical": true },
    { "id": "source.electron", "name": "Electron security", "lane": "evidence", "kind": "source", "status": "done", "detail": "Desktop trust boundary", "sensitivity": "public", "sourceRefs": [], "approvalState": "not_applicable", "publishState": "not_applicable", "outcomeState": "not_applicable", "permissions": ["source.read"], "canonical": true },
    { "id": "artifact.claim-ledger", "name": "Claim ledger", "lane": "evidence", "kind": "artifact", "status": "done", "version": "v2", "detail": "6 supported and 2 uncertain", "sensitivity": "workspace", "sourceRefs": ["source.hermes", "source.agent-skills", "source.mcp-tasks", "source.postiz", "source.pixverse", "source.electron"], "cost": { "currency": "USD", "micros": 1180000 }, "approvalState": "waiting", "publishState": "not_applicable", "outcomeState": "not_applicable", "permissions": ["workspace.read"], "canonical": true },
    { "id": "operator.saturation", "name": "Saturation scan", "lane": "evidence", "kind": "operator", "status": "done", "detail": "Canvas alone is a weak wedge", "sensitivity": "workspace", "sourceRefs": ["artifact.claim-ledger"], "cost": { "currency": "USD", "micros": 320000 }, "approvalState": "not_applicable", "publishState": "not_applicable", "outcomeState": "not_applicable", "permissions": ["research.read"] },
    { "id": "gate.research-review", "name": "Research review", "lane": "evidence", "kind": "gate", "status": "review", "detail": "Creator accepts claim set", "sensitivity": "workspace", "sourceRefs": ["artifact.claim-ledger"], "approvalState": "waiting", "publishState": "not_applicable", "outcomeState": "not_applicable", "permissions": ["approval.decide"] },

    { "id": "operator.angle", "name": "Angle generator", "lane": "creative", "kind": "operator", "status": "done", "detail": "Bounded four-step agent", "sensitivity": "workspace", "sourceRefs": ["idea.creator-os", "artifact.claim-ledger", "memory.audience"], "cost": { "currency": "USD", "micros": 860000 }, "approvalState": "not_applicable", "publishState": "not_applicable", "outcomeState": "not_applicable", "permissions": ["model.generate"] },
    { "id": "angle.memory", "name": "Memory angle", "lane": "creative", "kind": "artifact", "status": "review", "version": "v1", "detail": "Strongest strategic wedge", "sensitivity": "workspace", "sourceRefs": ["operator.angle", "artifact.claim-ledger"], "approvalState": "waiting", "publishState": "not_applicable", "outcomeState": "not_applicable", "permissions": ["workspace.read"], "canonical": false },
    { "id": "angle.canvas", "name": "Canvas angle", "lane": "creative", "kind": "artifact", "status": "review", "version": "v1", "detail": "Competitive correction", "sensitivity": "workspace", "sourceRefs": ["operator.angle", "operator.saturation"], "approvalState": "waiting", "publishState": "not_applicable", "outcomeState": "not_applicable", "permissions": ["workspace.read"], "canonical": false },
    { "id": "angle.provenance", "name": "Provenance angle", "lane": "creative", "kind": "artifact", "status": "review", "version": "v1", "detail": "Decision-graph story", "sensitivity": "workspace", "sourceRefs": ["operator.angle", "artifact.claim-ledger"], "approvalState": "waiting", "publishState": "not_applicable", "outcomeState": "not_applicable", "permissions": ["workspace.read"], "canonical": false },
    { "id": "decision.angle", "name": "Choose angle", "lane": "creative", "kind": "decision", "status": "review", "detail": "Current Focus item", "sensitivity": "personal", "sourceRefs": ["angle.memory", "angle.canvas", "angle.provenance", "artifact.claim-ledger"], "approvalState": "waiting", "publishState": "not_applicable", "outcomeState": "not_applicable", "permissions": ["approval.decide"] },
    { "id": "script.linkedin", "name": "LinkedIn script", "lane": "creative", "kind": "artifact", "status": "ready", "version": "v3", "detail": "Blocked by angle decision", "sensitivity": "workspace", "sourceRefs": ["decision.angle", "artifact.claim-ledger"], "cost": { "currency": "USD", "micros": 420000 }, "approvalState": "not_requested", "publishState": "not_applicable", "outcomeState": "not_applicable", "permissions": ["workspace.read"], "canonical": true },
    { "id": "draft.newsletter", "name": "Newsletter draft", "lane": "creative", "kind": "artifact", "status": "ready", "version": "v2", "detail": "Blocked by angle decision", "sensitivity": "workspace", "sourceRefs": ["decision.angle", "artifact.claim-ledger"], "cost": { "currency": "USD", "micros": 760000 }, "approvalState": "not_requested", "publishState": "not_applicable", "outcomeState": "not_applicable", "permissions": ["workspace.read"], "canonical": true },
    { "id": "script.reel", "name": "Reel script", "lane": "creative", "kind": "artifact", "status": "ready", "version": "v3", "detail": "Blocked by angle decision", "sensitivity": "workspace", "sourceRefs": ["decision.angle", "artifact.claim-ledger"], "cost": { "currency": "USD", "micros": 480000 }, "approvalState": "not_requested", "publishState": "not_applicable", "outcomeState": "not_applicable", "permissions": ["workspace.read"], "canonical": true },